{
  "schema_version": "ai-ascension.capabilities.v1",
  "collected_at": "2026-09-07",
  "source_snapshot": "execution/source-snapshot.json",
  "baseline_package_revision": "5a2acfd6690d2533af046a7afcf3a7782b29042b",
  "review_boundary": {
    "collector_role": "W01-L",
    "collector_thread_id": "01a07a4e-d58b-7953-9513-872ffdf45469",
    "independent_reviewer": null,
    "independent_review_status": "blocked_native_delegation_unavailable",
    "interpretation": "These records describe exact source or dated owner evidence. W01 did not rerun a game host, provider, deployment, or campaign, and no child reviewer was available. A source claim is not promoted to a fresh independent runtime result."
  },
  "capabilities": [
    {
      "capability_id": "CAP-ORG-POLICY",
      "display_label": "Organization policy and evidence ledger",
      "claim": "The organization publishes repository ownership, evidence labels, and dated source/runtime boundaries in its shared governance repository.",
      "source_url": "https://github.com/AI-Ascension/.github/blob/0cbdf744d515b16c042eb6e16b1537d8ccf11771/STATUS.md",
      "source_revision": "0cbdf744d515b16c042eb6e16b1537d8ccf11771",
      "evidence_kind": "source_derived",
      "verification_actor": "maintainer_reported",
      "public_artifact_availability": "report_only",
      "release_support": "none",
      "tested_configuration": "GitHub organization AI-Ascension; .github main at the exact source revision",
      "observed_at": "2026-09-07",
      "last_reviewed_at": "2026-09-07",
      "review_status": "unreviewed",
      "public_notes": "The current STATUS.md retains historical dated sections. Current repository heads and pull-request state are reconciled separately in execution/source-snapshot.json."
    },
    {
      "capability_id": "CAP-CORE-SEMANTICS",
      "display_label": "Host-independent STS2 domain core",
      "claim": "The sts2-game-core default source contains typed STS2 state/action values, pure validation, and deterministic in-memory tests without I/O.",
      "source_url": "https://github.com/AI-Ascension/sts2-game-core/blob/87e0f3d9355c0827e989d9fbc31804440852519b/README.md",
      "source_revision": "87e0f3d9355c0827e989d9fbc31804440852519b",
      "evidence_kind": "offline_test",
      "verification_actor": "maintainer_reported",
      "public_artifact_availability": "report_only",
      "release_support": "none",
      "tested_configuration": "sts2-game-core main; locked Rust workspace tests and policy checks as described by the exact README",
      "observed_at": "2026-09-05",
      "last_reviewed_at": "2026-09-07",
      "review_status": "unreviewed",
      "public_notes": "This does not establish a simulator, live host compatibility, gameplay, provider execution, or deployment."
    },
    {
      "capability_id": "CAP-MOD-BOUNDARY",
      "display_label": "Managed/native game-process boundary",
      "claim": "The sts2-game-mod source owns bounded host translation, a main-thread queue, versioned ABI admission, and a narrow HTTP adapter while leaving game authority with the host.",
      "source_url": "https://github.com/AI-Ascension/sts2-game-mod/blob/8b71150895ea95c0625afc1389bb08e4034d9350/README.md",
      "source_revision": "8b71150895ea95c0625afc1389bb08e4034d9350",
      "evidence_kind": "source_derived",
      "verification_actor": "maintainer_reported",
      "public_artifact_availability": "report_only",
      "release_support": "experimental_exact_fixture",
      "tested_configuration": "sts2-game-mod main; managed/native source boundary and target-local Rust package",
      "observed_at": "2026-09-07",
      "last_reviewed_at": "2026-09-07",
      "review_status": "unreviewed",
      "public_notes": "Source and CI evidence do not generalize beyond the documented host/version. Preserve package, manifest, ABI, environment, and loader identifiers during presentation work."
    },
    {
      "capability_id": "CAP-MOD-RUNTIME-V1",
      "display_label": "Bounded runtime-v1 host trace",
      "claim": "A dated owner report records an exact STS2 v0.107.1 Windows runtime-v1 probe through the managed/native boundary with a bounded host-visible effect and stale-generation rejection.",
      "source_url": "https://github.com/AI-Ascension/sts2-game-mod/blob/8b71150895ea95c0625afc1389bb08e4034d9350/docs/evidence/runtime-v1-host-live-20260902.md",
      "source_revision": "8b71150895ea95c0625afc1389bb08e4034d9350",
      "evidence_kind": "native_run",
      "verification_actor": "maintainer_reported",
      "public_artifact_availability": "report_only",
      "release_support": "experimental_exact_fixture",
      "tested_configuration": "STS2 v0.107.1 Windows x86-64; visible bounded status probe; harness -> MCP -> gateway -> mod -> host",
      "observed_at": "2026-09-02",
      "last_reviewed_at": "2026-09-07",
      "review_status": "unreviewed",
      "public_notes": "The owner report was inspected from the current default source but not rerun by W01. It is not a model-played campaign, a win, or general release compatibility."
    },
    {
      "capability_id": "CAP-MOD-FORCED-VICTORY",
      "display_label": "Forced terminal Victory observation",
      "claim": "A test-only fixture observes a living player at a native Victory surface with disabled input and an empty legal catalog on Windows and Linux.",
      "source_url": "https://github.com/AI-Ascension/sts2-game-mod/blob/8b71150895ea95c0625afc1389bb08e4034d9350/docs/evidence/native-victory-observation-20260906.md",
      "source_revision": "8b71150895ea95c0625afc1389bb08e4034d9350",
      "evidence_kind": "forced_fixture",
      "verification_actor": "maintainer_reported",
      "public_artifact_availability": "report_only",
      "release_support": "experimental_exact_fixture",
      "tested_configuration": "Forced native Windows/Linux STS2 v0.107.1 terminal fixture; ordinary play bypassed",
      "observed_at": "2026-09-06",
      "last_reviewed_at": "2026-09-07",
      "review_status": "unreviewed",
      "public_notes": "This is terminal observation only. It is not LLM control, a played boss fight, a campaign victory, or replay evidence."
    },
    {
      "capability_id": "CAP-GATEWAY-CONTRACT",
      "display_label": "Gateway lifecycle and stale-epoch fencing",
      "claim": "The gateway source and public browser fixture demonstrate deterministic lease/epoch fencing and fixed control routes at the bounded contract-test boundary.",
      "source_url": "https://github.com/AI-Ascension/sts2-gateway/blob/33ea48f3b549f08e19db80d8c68c1438fa12a60a/README.md",
      "source_revision": "33ea48f3b549f08e19db80d8c68c1438fa12a60a",
      "evidence_kind": "replay",
      "verification_actor": "maintainer_reported",
      "public_artifact_availability": "report_only",
      "release_support": "none",
      "tested_configuration": "sts2-gateway main; deterministic control_plane test mirrored by https://ai-ascension.github.io/proof.html",
      "observed_at": "2026-09-07",
      "last_reviewed_at": "2026-09-07",
      "review_status": "unreviewed",
      "public_notes": "The public page is a historical browser replay and currently cites an older gateway source pin. It does not establish a deployed gateway, game run, provider call, or model gameplay."
    },
    {
      "capability_id": "CAP-HARNESS-WINDOWS-DEFEAT",
      "display_label": "Windows seeded campaign to Defeat",
      "claim": "A dated owner record reports a visible Astra-controlled STS2 v0.107.1 Windows practice campaign reaching Defeat on floor 17 with 333 settled operations and a later fresh complete replay.",
      "source_url": "https://github.com/AI-Ascension/sts2-harness/blob/cb17b6c15262ce9356f1e85fd475af997aedc445/docs/evidence/seeded-astra-campaign-20260906.md",
      "source_revision": "cb17b6c15262ce9356f1e85fd475af997aedc445",
      "evidence_kind": "native_run",
      "verification_actor": "maintainer_reported",
      "public_artifact_availability": "report_only",
      "release_support": "experimental_exact_fixture",
      "tested_configuration": "Visible Windows x86-64 STS2 v0.107.1; seed AIASCENSIONV3FULL1; OpenAI Astra gpt-6-astra; harness -> MCP -> gateway -> mod",
      "observed_at": "2026-09-06",
      "last_reviewed_at": "2026-09-07",
      "review_status": "unreviewed",
      "public_notes": "This is a bounded defeat and replay report. Private trajectory/capture files remain outside the repository. It is not a verified win or broad compatibility result."
    },
    {
      "capability_id": "CAP-HARNESS-LINUX-DEFEAT",
      "display_label": "Linux seeded campaign to Defeat",
      "claim": "A dated owner record reports a visible Astra-controlled STS2 v0.107.1 Linux practice campaign reaching Defeat on floor 24 after one controller restart, with 431 settled operations and a later fresh complete replay.",
      "source_url": "https://github.com/AI-Ascension/sts2-harness/blob/cb17b6c15262ce9356f1e85fd475af997aedc445/docs/evidence/linux-seeded-campaign-20260906.md",
      "source_revision": "cb17b6c15262ce9356f1e85fd475af997aedc445",
      "evidence_kind": "native_run",
      "verification_actor": "maintainer_reported",
      "public_artifact_availability": "report_only",
      "release_support": "experimental_exact_fixture",
      "tested_configuration": "Visible Linux STS2 v0.107.1; seed AIASCENSIONV3FULL1; OpenAI Astra gpt-6-astra; one controller restart",
      "observed_at": "2026-09-06",
      "last_reviewed_at": "2026-09-07",
      "review_status": "unreviewed",
      "public_notes": "The report includes an independent audit claim for its replay, but W01 did not reproduce it. It is not uninterrupted control, a verified win, or broad compatibility."
    },
    {
      "capability_id": "CAP-MCP-ADAPTER",
      "display_label": "Authenticated MCP to gateway adapter",